{
  "packet_id": "ppauth-pass-zotero-metadata-live",
  "packet_mode": "synthetic_fixture",
  "selected_track": "zotero_metadata_live",
  "expected_validation_status": "PASS",
  "runtime_authorization": {
    "authorization_id": "ra-zotero-metadata-live-fixture-a1",
    "authorized_by": "fixture-human-reviewer",
    "authorized_at": "2026-06-15T00:00:00Z",
    "expires_at": "2026-06-16T00:00:00Z",
    "runtime_type": "zotero_live",
    "resource_binding": "live_resource",
    "data_class": "redacted",
    "allowed_commands": [
      "python -m ai_workflow_hub.cli paper real-zotero-metadata-pilot --authorization D:\\devframe-system\\.agent\\evidence\\zotero-metadata-live-fixture\\authorization.json"
    ],
    "allowed_paths": [
      "D:\\devframe-system\\.agent\\evidence\\zotero-metadata-live-fixture"
    ],
    "redaction_required": true,
    "evidence_output_path": "D:\\devframe-system\\.agent\\evidence\\zotero-metadata-live-fixture",
    "human_gate_reference": "fixture-human-gate-zotero-metadata-live-a1",
    "limitations": [
      "synthetic fixture only",
      "metadata-only boundary",
      "no final acceptance claim"
    ]
  },
  "test_run_spec": {
    "test_id": "tr-zotero-metadata-live-fixture-a1",
    "target_module": "dev-frame-opencode",
    "test_profile": "real_env_positive_pilot",
    "runtime_allowed": true,
    "runtime_authorization_id": "ra-zotero-metadata-live-fixture-a1",
    "expected_status": "blocked",
    "blocked_by_env_policy": "blocked_not_pass",
    "artifact_output_path": "D:\\devframe-system\\.agent\\evidence\\zotero-metadata-live-fixture\\test-execution-report.json",
    "notes": "Synthetic authorization packet fixture. It is not a real authorization."
  }
}
